id,title,description,scheduledAtUTC
1,Tech Conference 2025,"An annual conference discussing the latest in technology, including advancements in cybersecurity, emerging threats, and innovative solutions to protect digital assets. Experts from around the world will share their insights and experiences, making it a must-attend event for tech enthusiasts.",2025-11-15T09:00:00Z
2,Startup Pitch Night,"A night for startups to pitch their ideas to investors, with a special focus on cybersecurity innovations. Entrepreneurs will present their groundbreaking solutions to address the ever-evolving cyber threats, aiming to secure funding and partnerships to bring their ideas to market.",2025-12-01T18:00:00Z
3,AI & Machine Learning Workshop,"A workshop on the latest trends in AI and machine learning, with a dedicated segment on how these technologies are being leveraged to enhance cybersecurity measures. Participants will learn about cutting-edge algorithms and techniques to detect and prevent cyber attacks.",2025-11-20T10:00:00Z
4,Blockchain Summit 2025,"Exploring the future of blockchain technology and its applications in cybersecurity. This summit will cover topics such as secure transactions, decentralized networks, and how blockchain can be used to create tamper-proof systems, ensuring data integrity and privacy.",2025-12-05T09:00:00Z
5,Web Development Bootcamp,"An intensive bootcamp on modern web development practices, with a strong emphasis on building secure web applications. Attendees will learn about the latest security protocols, best practices for coding, and how to protect web applications from common vulnerabilities and attacks.",2025-11-25T09:00:00Z
6,Digital Marketing Seminar,"Learn the latest strategies in digital marketing, including how to protect your online presence from cyber threats. This seminar will cover topics such as secure data handling, protecting customer information, and strategies to prevent cyber attacks on marketing campaigns.",2025-12-10T14:00:00Z
7,Cybersecurity Conference,"Discussing the latest in cybersecurity threats and solutions, this conference will bring together experts to share their knowledge on topics such as threat detection, incident response, and the latest tools and technologies to safeguard digital assets. A must-attend for cybersecurity professionals.",2025-11-30T09:00:00Z
8,Data Science Meetup,"A meetup for data science enthusiasts to share knowledge, with a focus on how data science is being used to enhance cybersecurity. Participants will discuss techniques for analyzing large datasets to identify potential threats and vulnerabilities, and how to use data-driven insights to improve security.",2025-12-15T18:00:00Z
9,Product Management Workshop,"Learn the essentials of product management, including how to incorporate cybersecurity into the product development lifecycle. This workshop will cover best practices for ensuring that products are secure from the ground up, and how to address security concerns throughout the development process.",2025-11-22T10:00:00Z
10,UX/UI Design Conference,"Exploring the latest trends in UX/UI design, with a focus on creating secure user experiences. Attendees will learn about designing interfaces that protect user data, prevent phishing attacks, and ensure that security is an integral part of the user experience.",2025-12-08T09:00:00Z
11,Mobile App Development Seminar,"Learn how to develop mobile applications with a strong emphasis on security. This seminar will cover topics such as secure coding practices, protecting user data, and how to defend against common mobile threats like malware and unauthorized access.",2025-11-28T14:00:00Z
12,Cloud Computing Summit,"Discussing the future of cloud computing and its implications for cybersecurity. This summit will cover topics such as securing cloud infrastructure, protecting data in transit and at rest, and best practices for managing cloud security in a rapidly evolving threat landscape.",2025-12-12T09:00:00Z
13,Big Data Analytics Workshop,"A workshop on big data analytics techniques, with a focus on how these techniques can be used to enhance cybersecurity. Participants will learn about analyzing large datasets to detect anomalies, identify potential threats, and develop strategies to mitigate risks.",2025-11-18T10:00:00Z
14,Entrepreneurship Bootcamp,"An intensive bootcamp for aspiring entrepreneurs, with a special focus on cybersecurity startups. Participants will learn about the unique challenges and opportunities in the cybersecurity market, and how to develop innovative solutions to address the growing demand for security.",2025-12-03T09:00:00Z
15,Virtual Reality Expo,"Exploring the latest in virtual reality technology and its applications in cybersecurity. This expo will cover topics such as secure VR environments, protecting user data in virtual spaces, and how VR can be used for cybersecurity training and simulations.",2025-11-27T09:00:00Z
16,Fintech Conference,"Discussing the future of financial technology and its intersection with cybersecurity. This conference will cover topics such as securing financial transactions, protecting customer data, and how fintech companies can stay ahead of emerging cyber threats.",2025-12-07T09:00:00Z
17,DevOps Workshop,"Learn the essentials of DevOps practices, with a focus on integrating security into the DevOps pipeline. This workshop will cover topics such as automated security testing, continuous monitoring, and how to ensure that security is a key consideration throughout the development and deployment process.",2025-11-21T10:00:00Z
18,Game Development Meetup,"A meetup for game developers to share knowledge, with a focus on securing online games and protecting player data. Participants will discuss best practices for preventing cheating, safeguarding user information, and ensuring that games are secure from cyber threats.",2025-12-14T18:00:00Z
19,Robotics Expo,"Exploring the latest in robotics technology and its implications for cybersecurity. This expo will cover topics such as securing robotic systems, protecting data in robotic networks, and how to defend against cyber attacks targeting robotics.",2025-11-29T09:00:00Z
20,HealthTech Summit,"Discussing the future of health technology and its intersection with cybersecurity. This summit will cover topics such as protecting patient data, securing medical devices, and how to address the unique cybersecurity challenges faced by the healthcare industry.",2025-12-09T09:00:00